Day,Task,Priority,Status,Notes
Day 1,Create GitHub repo,High,Done,Git repository is already initialized and active in this workspace.
Day 1,Initialize Next.js app,High,Done,Next.js app is set up with app router and dependencies in package.json.
Day 1,Setup folder structure,High,Done,App pages components public and docs folders are already in place.
Day 1,Connect to Vercel,High,To Do,No Vercel configuration or deployment evidence found in the repo.
Day 1,Create Sanity project,High,Done,Sanity config studio route and environment wiring are present in the repository.

Day 2,Create Experience schema,High,Done,Experience schema exists in sanity/schemaTypes/experience.ts.
Day 2,Create Project schema,High,Done,Project schema exists in sanity/schemaTypes/project.ts.
Day 2,Create Blog schema,High,Done,Post schema exists in sanity/schemaTypes/post.ts.
Day 2,Add SEO fields,High,Done,Project and post schemas include SEO title and meta description fields.
Day 2,Input dummy content,Medium,Done,At least one project entry is published in Sanity Studio and the frontend now reads CMS data.

Day 3,Define homepage sections,High,Done,Homepage hero selected projects and experience sections are implemented in app/(site)/page.tsx.
Day 3,Define experience page structure,High,Done,Experience page structure is implemented with summary cards in app/(site)/experience/page.tsx.
Day 3,Define projects page structure,High,Done,Projects page uses case-study style problem approach and impact sections.
Day 3,Define blog structure,High,Partial,Blog listing exists and is now CMS-backed but no blog detail route or post template exists yet.

Day 4,Build layout (navbar/footer),High,Partial,Navbar is implemented in components/navbar.tsx but footer is still missing.
Day 4,Build homepage,High,Done,Homepage is built as a static marketing page.
Day 4,Build experience page,High,Done,Experience page now fetches and renders experience entries from Sanity with an empty state fallback.
Day 4,Build projects page,High,Done,Projects page now fetches and renders project case studies from Sanity with an empty state fallback.
Day 4,Build blog listing,High,Done,Blog listing now fetches and renders post summaries from Sanity with an empty state fallback.
Day 4,Build blog detail page,High,To Do,No dynamic or static detail route exists under app/blog.

Day 5,Setup metadata,High,Partial,Global metadata exists in app/layout.tsx but per-page metadata is not implemented.
Day 5,Setup Open Graph,Medium,To Do,No Open Graph metadata fields or images found.
Day 5,Generate sitemap.xml,High,To Do,No sitemap route or generated sitemap file found.
Day 5,Setup robots.txt,High,To Do,No robots route or public robots.txt file found.
Day 5,Add structured data,High,To Do,No JSON-LD or schema markup implementation found.

Day 6,Write project 1,High,Done,Project content is now sourced from Sanity and available for frontend rendering.
Day 6,Write project 2,High,Done,Project content is now sourced from Sanity and available for frontend rendering.
Day 6,Write project 3,High,Done,Project content is now sourced from Sanity and available for frontend rendering.
Day 6,Write blog article 1,Medium,Partial,Post list content can now come from Sanity but no full article page or body rendering exists yet.
Day 6,Write blog article 2,Medium,Partial,Post list content can now come from Sanity but no full article page or body rendering exists yet.

Day 7,QA all pages,High,Partial,Projects blog and experience routes were validated in a clean preview workspace after CMS integration but full QA is still pending.
Day 7,Check mobile responsiveness,High,Partial,Responsive utility classes are present but manual device QA is not documented.
Day 7,Fix bugs,High,In Progress,Documented local build and runtime blockers in docs/BUILD_ISSUES.md and applied the CMS frontend integration.
Day 7,Deploy to production,High,To Do,Production deployment is not confirmed from this repository state.
